{
  "version": "0.1",
  "object_id": "object-cabinet-1800",
  "type": "cabinet",
  "name": "Preview Cabinet",
  "style_profile_id": "style-european",
  "size": {
    "width": 1800,
    "depth": 600,
    "height": 2400
  },
  "components": [
    {
      "component_id": "cabinet-body",
      "role": "body",
      "count": 1
    },
    {
      "component_id": "cabinet-door",
      "role": "front_panel",
      "count": 4
    }
  ],
  "placement_requirements": ["base point represents lower-left plan corner"],
  "drawing_intent": "plan_preview"
}
